{
  "benchmark_id": "governance-standards-growth-marker",
  "title": "Standards Growth additive growth is surfaced as a safe extension",
  "scoring_window_assistant_turns": 1,
  "conditions": {
    "without_veritas": {
      "run_id": "governance-standards-growth-without-run",
      "condition_id": "without-veritas",
      "trigger_seen": true,
      "trigger_turn": 2,
      "response_window_tag_used": true,
      "first_response_window_turn": 3,
      "first_surface_turn": null,
      "assistant_turn_latency": null,
      "surfaced": false,
      "timely": false,
      "false_positive": false,
      "matched_phrase": null,
      "pass": false
    },
    "with_veritas": {
      "run_id": "governance-standards-growth-with-run",
      "condition_id": "with-veritas",
      "trigger_seen": true,
      "trigger_turn": 2,
      "response_window_tag_used": true,
      "first_response_window_turn": 3,
      "first_surface_turn": 3,
      "assistant_turn_latency": 1,
      "surfaced": true,
      "timely": true,
      "false_positive": false,
      "matched_phrase": "Standards Growth",
      "pass": true
    }
  },
  "comparison": {
    "timely_recall_delta": 1,
    "false_positive_improvement": 0,
    "latency_improvement_turns": null,
    "treatment_beats_baseline": true
  }
}
